1;"ola";2021-10-18T13:30:12.000Z;Manuel
2;"ola, me informe seu nome";2021-10-18T13:30:12.000Z;ContatoInteligente
2;"Manuel";2021-10-18T13:30:12.000Z;Manuel
3;"obrigado, vamos prosseguir com o atendimento";2021-10-18T13:30:12.000Z;ContatoInteligente
4;"Escolha uma das opções 1) Inforamções sobre compra 2) Compra 3) Falar com atendente";2021-10-18T13:30:12.000Z;ContatoInteligente
5;"2";2021-10-18T13:30:12.000Z;Manuel
6;"Você escolheu a opção 1) Inforamções sobre compra. Agora me diga, o que você gostaria de saber sobre sua compra";2021-10-18T13:30:12.000Z;ContatoInteligente